Gene Symbol,Name,Entrez GeneId,Genome Location,Chr Band,Somatic,Germline,Tumour Types(Somatic),Tumour Types(Germline),Cancer Syndrome,Tissue Type,Molecular Genetics,Role in Cancer,Mutation Types,Translocation Partner,Other Germline Mut,Other Syndrome,Synonyms
HSP90AA1,"heat shock protein 90kDa alpha (cytosolic), class A member 1",3320,14:102081712-102139404,14q32.33,yes,,NHL,,,L,Dom,,T,BCL6,,,"3320,ENSG00000080824,FLJ31884,HSP86,Hsp89,Hsp90,HSP90A,HSP90N,HSPC1,HSPCA,HSPCAL1,HSPCAL4,HSPN,LAP2,P07900,HSP90AA1"
HSP90AB1,"heat shock protein 90kDa alpha (cytosolic), class B member 1",3326,6:44248630-44253598,6p12,yes,,NHL,,,L,Dom,,T,BCL6,,,"HSP90AB1,HSPCB,FLJ26984,HSPC2,D6S182,P08238,HSP90-BETA,HSP90B,ENSG00000096384,3326"
IDH1,"isocitrate dehydrogenase 1 (NADP+), soluble",3417,2:208237079-208251551,2q33.3,yes,,glioblastoma,,,O,Dom,oncogene,Mis,,,,"3417,IDP,O75874,PICD,IDH,ENSG00000138413,IDH1"
IDH2,"isocitrate dehydrogenase 2 (NADP+), mitochondrial",3418,15:90084266-90102390,15q26.1,yes,,glioblastoma,,,O,Dom,oncogene,Mis,,,,"IDH2,P48735,ICD-M,IDP,IDH,mNADP-IDH,IDHM,ENSG00000182054,3418"
IGH,immunoglobulin heavy locus,3492,14:-,14q32.33,yes,,"MM, Burkitt lymphoma, NHL, CLL, B-ALL, MALT, MLCLS",,,L,Dom,,T,"MYC, FGFR3, PAX5, FCRL4, IRF4, CCND1, BCL9, BCL8, BCL6, BCL2, BCL3, BCL10, BCL11A. LHX4, DDX6, NFKB2, PAFAH1B2, PCSK7, CRLF2",,,
IGK,immunoglobulin kappa locus,50802,2:-,2p12,yes,,"Burkitt lymphoma, B-NHL",,,L,Dom,,T,"MYC, KDSR",,,
IGL,immunoglobulin lambda locus,3535,22:-,22q11.2,yes,,Burkitt lymphoma,,,L,Dom,,T,"BCL9, MYC, CCND2",,,
IKBKB,"inhibitor of kappa light polypeptide gene enhancer in B-cells, kinase beta",3551,8:42272100-42330979,8p11.2,yes,,SMZL,,,L,Dom,,Mis,,yes,Immunodeficiency 15,"IKBKB,O14920,ENSG00000104365,3551"
IKZF1,IKAROS family zinc finger 1,10320,7:50319062-50400628,7p12.2,yes,,"ALL, DLBCL",,,L,Dom/Rec,TSG,"D,T",BCL6,,,"10320,LyF-1,IKAROS,ZNFN1A1,hIk-1,Hs_54452,Q13422,ENSG00000185811,IKZF1"
IL2,interleukin 2,3558,4:122451752-122456440,4q26-q27,yes,,intestinal T-cell lymphoma,,,L,Dom,,T,TNFRSF17,,,"3558,IL-2,P60568,ENSG00000109471,IL2"
IL21R,interleukin 21 receptor,50615,16:27430073-27449284,16p11,yes,,NHL,,,L,Dom,,T,BCL6,,,"IL21R,Q9HBE5,ENSG00000103522,50615"
IL6ST,"interleukin 6 signal transducer (gp130, oncostatin M receptor)",3572,5:55941082-55976278,5q11,yes,,hepatocellular carcinoma,,,E,Dom,,O,,,,"3572,CDw130,CD130,GP130,GP130-RAPS,IL6R-beta,P40189,ENSG00000134352,IL6ST"
IL7R,interleukin 7 receptor,3575,5:35856978-35876486,5p13,yes,,"ALL, ETP ALL",,,L,Dom,,"Mis, O",,yes,Severe combined immune deficiency,"P16871,IL7R,3575,ENSG00000168685,CD127,CDW127,IL-7R-alpha"
IRF4,interferon regulatory factor 4,3662,6:393154-407599,6p25-p23,yes,,MM,,,L,Dom,oncogene/TSG,T,IGH,,,"3662,LSIRF,Q15306,ENSG00000137265,IRF4"
ITK,IL2-inducible T-cell kinase,3702,5:157180978-157252678,5q31-q32,yes,,peripheral T-cell lymphoma,,,L,Dom,,T,SYK,,,"ITK,PSCTK2,MGC126257,LYK,MGC126258,EMT,ENSG00000113263,Q08881,3702"
JAK1,Janus kinase 1,3716,1:64834562-64886264,1p32.3-p31.3,yes,,ALL,,,L,Dom,,Mis,,,,"P23458,ENSG00000162434,JAK1_ENST00000342505,3716,JAK1A,JAK1B,JTK3"
JAK2,Janus kinase 2,3717,9:5021988-5126791,9p24,yes,,"ALL, AML, MPN,  CML",,,L,Dom,oncogene,"T, Mis, O","ETV6, PCM1, BCR",,,"O60674,ENSG00000096968,JAK2_ENST00000381652,3717,JTK10"
JAK3,Janus kinase 3,3718,19:17826743-17844417,19p13.1,yes,,"acute megakaryocytic leukaemia, ETP ALL",,,L,Dom,,Mis,,,,"3718,L-JAK,JAK3_HUMAN,LJAK,JAK-3,JAKL,P52333,ENSG00000105639,JAK3"
JAZF1,juxtaposed with another zinc finger gene 1,221895,7:27832800-28180577,7p15.2-p15.1,yes,,endometrial stromal tumour,,,M,Dom,,T,SUZ12,,,"221895,Q86VZ6,ENSG00000153814,JAZF1"
JUN,jun oncogene,3725,1:58782075-58783070,1p32-p31,yes,,sarcoma,,,M,Dom,,A,,,,"JUN,P05412,c-Jun,AP1,ENSG00000177606,3725"
KAT6A,K(lysine) acetyltransferase 6A,7994,8:-,8p11,yes,,AML,,,L,Dom,,T,"CREBBP, NCOA2, EP300",,,
KAT6B,K(lysine) acetyltransferase 6B,23522,10:74842858-75031046,10q22.2,yes,,AML,,,L,Dom,,T,CREBBP,,,"23522,DKFZp313G1618,FLJ90335,KIAA0383,MORF,MOZ2,qkf,querkopf,Q8WYB5,ENSG00000156650,KAT6B,MYST4"
KCNJ5,"potassium inwardly-rectifying channel; subfamily J; member 5",3762,11:128911274-128916731,11q24,yes,,adrenal adenoma,,,E,Dom,,Mis,,yes,"Familial hyperaldosteronism type III, Long QT syndrome","3762,ENSG00000120457,GIRK4,KATP1,KIR3_4,P48544,KCNJ5"
KDM5A,"lysine (K)-specific demethylase 5A, JARID1A",5927,12:285456-389091,12p11,yes,,AML,,,L,Dom,,T,NUP98,,,"5927,RBBP2,ENSG00000073614,JARID1A,JARID1A"
KDM5C,lysine (K)-specific demethylase 5C (JARID1C),8242,X:53192967-53224889,Xp11.22-p11.21,yes,,clear cell renal carcinoma,,,E,Rec,,"N, F, S, Mis",,yes, X-linked mental retardation syndromic Claes-Jensen-type.,"SMCX,XE169,RP11-258C19_2,MRXJ,MRXSJ,DXS1272E,ENSG00000126012,SMCX,8242,JARID1C"
KDM6A,"lysine (K)-specific demethylase 6A, UTX",7403,X:44873552-45111411,Xp11.2,yes,,"renal cell carcinoma, bladder carcinoma, oesophageal SCC, MM, medulloblastoma, T-ALL, other tumour types",,,"E, L",Rec,,"D, N, F, S",,yes,Kabuki syndrome,"UTX,O15550,bA386N14_2,MGC141941,RP13-886N14_3,DKFZp686A03225,ENSG00000147050,7403,UTX"
KDR,vascular endothelial growth factor receptor 2,3791,4:55079941-55125293,4q11-q12,yes,,"NSCLC, angiosarcoma",,,E,Dom,,Mis,,,,"3791,VEGFR2,FLK1,CD309,VEGFR,P35968,ENSG00000128052,KDR"
KDSR,3-ketodihydrosphingosine reductase,2531,18:63331782-63367118,18q21.3,yes,,B-NHL,,,L,Dom,,T,IGK,,,"FVT1,Q06136,FVT1,ENSG00000119537,2531"
KIAA1549,KIAA1549,57670,7:138837906-138919418,7q34,yes,,pilocytic astrocytoma,,,O,Dom,,T,BRAF,,,"57670,ENSG00000122778,KIAA1549"
KIAA1598,KIAA1598,57698,10:116886555-117005079,10q25.3,yes,,Spitzoid tumour,,,E,Dom,,T,ROS1,,,"57698,ENSG00000187164,DKFZp686A0439,MGC40476,shootin-1,shootin1,KIAA1598"
KIF5B,kinesin family member 5B,3799,10:32009010-32055973,10p11.22,yes,,"NSCLC, Spitzoid tumour",,,E,Dom,,T,"RET, ALK",,,"3799,ENSG00000170759,KINH,KNS,KNS1,UKHC,P33176,KIF5B"
KIT,v-kit Hardy-Zuckerman 4 feline sarcoma viral oncogene homolog,3815,4:54658015-54738557,4q12,yes,yes,"GIST, AML, TGCT, mastocytosis, mucosal melanoma","GIST, epithelioma",familial gastrointestinal stromal tumour,"L, M, O, E",Dom,oncogene,"Mis, O",,yes,Piebald trait,"3815,C-Kit,P10721,SCFR,CD117,ENSG00000157404,KIT"
KLF4,Kruppel-like factor 4,9314,9:107485751-107489172,9q31,yes,,meningioma,,,O,Dom,oncogene,Mis,,,,"KLF4,EZF,O43474,GKLF,ENSG00000136826,9314"
KLF6,Kruppel-like factor 6,1316,10:3779539-3785014,10p15,yes,,"prostate, glioma",,,"E, O",Rec,,"Mis, N",,,,"1316,RP11-184A2_1,BCD1,GBF,PAC1,ZF9,COPEB,Zf9,CPBP,DKFZp686N0199,ST12,ENSG00000067082,KLF6"
KLK2,kallikrein-related peptidase 2,3817,19:50873474-50878559,19q13.41,yes,,prostate,,,E,Dom,,T,ETV4,,,"KLK2,P20151,KLK2A2,hK2,MGC12201,ENSG00000167751,3817"
KMT2A,lysine (K)-specific methyltransferase 2A,4297,11:118436513-118522172,11q23,yes,,"AML, ALL",,,L,Dom,oncogene,"T, O","KMT2A, MLLT1, AFF1, MLLT3, MLLT4, FOXO4, MLLT10, MLLT6, ELL, EPS15, MLLT11, CREBBP, SH3GL1, FNBP1, SEPT5, SEPT9, GPHN, GMPS, ABI1, ARHGEF12, GAS7, FOXO3, AFF3, TET1, SEPT6, LPP, RUNX1T1, ARHGAP26, EP300, PICALM, CLP1, PRRC1, DAB2IP, MAPRE1, KIAA1524, SEPT2, SARNP, ZFYVE19, TOP3A, CASC5, EEFSEC, FRYL, SORBS2, ABI2, LASP1, CASP8AP2, AFF4, NRIP3, NCKIPSD, CBL, ACTN4, PDS5A, CT45A2, MYO1F, KIAA0284, BTBD18",,,"KMT2A,TRX1,CXXC7,MLL1A,ALL-1,HRX,HTRX1,MLL/GAS7,ENSG00000118058,MLL,4297"
KMT2C,lysine (K)-specific methyltransferase 2C,58508,7:152136832-152435786,7q36.1,yes,,medulloblastoma,,,O,Rec,,N,,,,"KMT2C,ENSG00000055609,58508,MLL3"
KMT2D,lysine (K)-specific methyltransferase 2D,8085,12:49021780-49055324,12q13.12,yes,,"medulloblastoma, renal",,,"O, E",Rec,,"N, F, Mis",,,,"KMT2D,ENSG00000167548,MLL2,8085"
KRAS,v-Ki-ras2 Kirsten rat sarcoma 2 viral oncogene homolog,3845,12:25209795-25245384,12p12.1,yes,,"pancreatic, colorectal, lung, thyroid, AML, other tumour types",,,"L, E, M, O",Dom,oncogene,Mis,,,,"KRAS,C-K-RAS,RASK2,K-RAS2B,KRAS1,K-RAS4B,K-RAS2A,K-RAS4A,KRAS2,KI-RAS,NS3,P01116,3845"
KTN1,kinectin 1 (kinesin receptor),3895,14:55612050-55680691,14q22.1,yes,,papillary thyroid,,,E,Dom,,T,RET,,,"KTN1,Q86UP2,CG1,KIAA0004,ENSG00000126777,3895"
LASP1,LIM and SH3 protein 1,3927,17:38870190-38918778,17q11-q21.3,yes,,AML,,,L,Dom,,T,KMT2A,,,"3927,ENSG00000002834,Lasp-1,MLN50,Q14847,LASP1"
LCK,lymphocyte-specific protein tyrosine kinase,3932,1:32274330-32285716,1p35-p34.3,yes,,T-ALL,,,L,Dom,,T,TRB,,,"3932,YT16,pp58lck,p56lck,ENSG00000182866,P06239,LCK"
LCP1,lymphocyte cytosolic protein 1 (L-plastin),3936,13:46127591-46159662,13q14.1-q14.3,yes,,NHL,,,L,Dom,,T,BCL6,,,"LCP1,CP64,LC64P,PLS2,FLJ26114,P13796,FLJ25423,L-PLASTIN,DKFZp781A23186,FLJ39956,ENSG00000136167,3936"
LEF1,lymphoid enhancer binding factor 1,51176,4:108063629-108167767,4q25,yes,,"B-ALL, T-ALL, eyelid sebaceous carcinoma, AML, lymphomas",,,"L, E",,oncogene/TSG,"Mis, N",,,,"51176,TCF1ALPHA,DKFZp586H0919,Q9UJU2,ENSG00000138795,LEF1"
LHFP,lipoma HMGIC fusion partner,10186,13:39343936-39601216,13q12,yes,,lipoma,,,M,Dom,,T,HMGA2,,,"LHFP,MGC22429,ENSG00000183722,10186"
LIFR,leukemia inhibitory factor receptor,3977,5:38481595-38530647,5p13-p12,yes,,salivary adenoma,,,E,Dom,,T,PLAG1,,,"LIFR,SJS2,CD118,STWS,SWS,ENSG00000113594,3977"
LMNA,lamin A/C,4000,1:156114919-156139106,1q22,yes,,Spitzoid tumour,,,E,Dom,,T,NTRK1,yes,"Muscular dystrophy, dilated cardiomyopathy,  familial partial lipodystrophy, and others","LMNA,EMD2,FPL,CMT2B1,LMN1,CDCD1,CMD1A,IDC,LFP,P02545,HGPS,CDDC,FPLD,LMNC,PRO1,LDP1,LGMD1B,ENSG00000160789,4000"
LMO1,LIM domain only 1 (rhombotin 1) (RBTN1),4004,11:8224616-8268634,11p15,yes,yes,"T-ALL, neuroblastoma",neuroblastoma,,L,Dom,,"T, A",TRD,,,"LMO1,RBTN1,TTG1,RHOM1,P25800,ENSG00000166407,4004"
LMO2,LIM domain only 2 (rhombotin-like 1) (RBTN2),4005,11:33859356-33869386,11p13,yes,,T-ALL,,,L,Dom,,T,TRD,,,"4005,RBTN2,RHOM2,RBTNL1,TTG2,P25791,ENSG00000135363,LMO2"
LPP,LIM domain containing preferred translocation partner in lipoma,4026,3:188406122-188874480,3q28,yes,,"lipoma, leukaemia",,,"L, M",Dom,,T,"HMGA2, KMT2A, C12orf9",,,"4026,Q93052,ENSG00000145012,LPP"
LRIG3,leucine-rich repeats and immunoglobulin-like domains 3,121227,12:58872572-58920235,12q14.1,yes,,NSCLC,,,E,Dom,,T,ROS1,,,"121227,Q6UXM1,FLJ26573,KIAA3016,FLJ90440,ENSG00000139263,LRIG3"
LSM14A,"LSM14A, SCD6 homolog A (S. cerevisiae)",26065,19:34172643-34227388,19q13.11,yes,,Spitzoid tumour,,,E,Dom,,T,BRAF,,,"26065,ENSG00000105216,C19orf13,DKFZP434D1335,FAM61A,RAP55,LSM14A"
LYL1,lymphoblastic leukemia derived sequence 1,4066,19:13099319-13101171,19p13.2-p13.1,yes,,T-ALL,,,L,Dom,,T,TRB,,,"LYL1,P12980,ENSG00000104903,4066"
LZTR1,leucine-zipper-like transcription regulator 1,8216,22:20982372-20997348,22q11.21,yes,yes,glioblastoma,"glioblastoma, schwannoma",Schwannomatosis-2,E,Dom,TSG,"Mis, F, N",,yes,Noonan syndrome 10,"8216,ENSG00000099949,LZTR-1,MGC21205,TCFL2,Q8N653,LZTR1"
MAF,v-maf musculoaponeurotic fibrosarcoma oncogene homolog,4094,16:79594460-79599902,16q22-q23,yes,,MM,,,L,Dom,,T,IGH,,,"MAF,MGC71685,ENSG00000178573,4094"
MAFB,v-maf musculoaponeurotic fibrosarcoma oncogene homolog B (avian),9935,20:40687879-40688850,20q11.2-q13.1,yes,,MM,,,L,Dom,,T,IGH,,,"MAFB,Q9Y5Q3,KRML,MGC43127,ENSG00000204103,9935"
MALAT1,"metastasis associated lung adenocarcinoma transcript 1 ( lnc-RNA; non-protein coding)",378938,11:65502644-65502817,11q31.1,yes,,"renal cell carcinoma (childhood epithelioid), lung",,,E,Dom,,T,TFEB,,,"MALAT1,PRO1073,Q9UHZ2,378938"
MALT1,mucosa associated lymphoid tissue lymphoma translocation gene 1,10892,18:58671645-58747843,18q21,yes,,MALT,,,L,Dom,,T,BIRC3,,,"MALT1,ENSG00000172175,10892"
MAML2,mastermind-like 2 (Drosophila),84441,11:95978948-96341895,11q22-q23,yes,,salivary gland mucoepidermoid,,,E,Dom,,T,"CRTC3, CRTC1",,,"84441,MAM3,MAM2,DKFZp686N0150,KIAA1819,Q8IZL2,MLL-MAML2,MAM-3,ENSG00000184384,MAML2"
MAP2K1,mitogen-activated protein kinase kinase 1,5604,15:66387348-66490615,15q22.1-q22.33,yes,,"NSCLC, melanoma, colorectal",,,E,Dom,,Mis,,yes,Cardiofaciocutaneous syndrome,"5604,MAPKK1,PRKMK1,MKK1,MEK1,Q02750,ENSG00000169032,MAP2K1"
MAP2K2,mitogen-activated protein kinase kinase 2,5605,19:4090598-4123875,19p13.3,yes,,"NSCLC, melanoma",,,E,Dom,,Mis,,yes,Cardiofaciocutaneous syndrome,"MAP2K2,MEK2,PRKMK2,MAPKK2,MKK2,P36507,ENSG00000126934,5605"
MAP2K4,mitogen-activated protein kinase kinase 4,6416,17:12020887-12141260,17p11.2,yes,,"pancreatic, breast, colorectal",,,E,Rec,,"D, Mis, N",,,,"6416,MEK4,SEK1,JNKK,MAPKK4,PRKMK4,MKK4,JNKK1,SERK1,ENSG00000065559,P45985,MAP2K4"
MAP3K1,"mitogen-activated protein kinase kinase kinase 1, E3 ubiquitin protein ligase",4214,5:56152434-56189507,5q11.2,yes,,luminal A breast,,,E,Rec,,"N, F, Mis, O, S",,yes,"46,XY sex reversal 6","MAP3K1,ENSG00000095015,MAPKKK1,MEKK,MEKK1,Q13233,4214"
MAP3K13,mitogen-activated protein kinase kinase kinase 13,9175,3:185428582-185482456,3q27,yes,,breast,,,E,Rec,,F,,,,"9175,MGC133196,LZK,ENSG00000073803,MAP3K13"
MAX,Myc associated factor X,4149,14:65076476-65102339,14q23,yes,yes,"pheochromocytoma, endometrioid carcinoma, colon carcinoma",pheochromocytoma,,"E, O",Rec,,"Mis, N, F",,,,"MAX,MGC36767,MGC34679,orf1,MGC11225,P61244,MGC10775,MGC18164,ENSG00000125952,4149"
MDM2,Mdm2 p53 binding protein homolog,4193,12:68808478-68839849,12q15,yes,,"sarcoma, glioma, colorectal, other tumour types",,,"M, O, E, L",Dom,oncogene,A,,,,"4193,HDM2,Q00987,hdm2,MGC71221,HDMX,ENSG00000135679,MDM2"
MDM4,Mdm4 p53 binding protein homolog,4194,1:204525519-204549682,1q32,yes,,"glioblastoma, bladder, retinoblastoma",,,M,Dom,oncogene,A,,,,"MDM4,DKFZp781B1423,MGC132766,MDMX,MRP1,RP11-430C7_1,ENSG00000198625,4194"
MDS2,myelodysplastic syndrome 2,259283,1:23629556-23640550,1p36,yes,,MDS,,,L,Dom,,T,ETV6,,,"MDS2,Q8NDY4,ENSG00000197880,259283"
MECOM,MDS1 and EVI1 complex locus,2122,3:169084909-169131477,3q26.2,yes,,"AML, CML, MDS",,,L,Dom,oncogene,T,"RUNX1, ETV6, PRDM16, RPN1",,,"EVI1,MDS1-EVI1,PRDM3,Q03112,ENSG00000085276,2122,EVI1"
MED12,mediator complex subunit 12,9968,X:71118755-71142218,Xq13,yes,,uterine leiomyoma,,,M,Dom,,"Mis, S",,yes,Opitz-Kaveggia Syndrome,"Q93074,MED12_ENST00000374080,9968,ARC240,CAGH45,FGS1,HOPA,KIAA0192,OKS,TNRC11,TRAP230"
MEN1,multiple endocrine neoplasia type 1 gene,4221,11:64804334-64810109,11q13,yes,yes,"parathyroid tumours, pancreatic neuroendocrine tumour","parathyroid adenoma, pituitary adenoma, pancreatic islet cell, carcinoid",multiple endocrine neoplasia type 1,E,Rec,TSG,"D, Mis, N, F, S",,,,"MEN1,ENSG00000133895,4221"
MET,met proto-oncogene (hepatocyte growth factor receptor),4233,7:116699085-116796124,7q31,yes,,"papillary renal, head-neck squamous cell",papillary renal,familial papillary renal cancer,E,Dom,oncogene,Mis,,,,"4233,RCCP2,AUTS9,HGFR,P08581,ENSG00000105976,MET"
MITF,microphthalmia-associated transcription factor,4286,3:69936723-69965248,3p14.1,yes,,melanoma,,,E,Dom,,A,,yes,"Waardenburg syndrome type 2, Tietz syndrome","WS2A,MITF,4286,ENSG00000187098"
MKL1,megakaryoblastic leukemia (translocation) 1,57591,22:40411390-40463227,22q13,yes,,acute megakaryocytic leukaemia,,,L,Dom,,T,RBM15,,,"57591,BSAC,MRTF-A,Q969V6,ENSG00000196588,MKL1"
MLF1,myeloid leukemia factor 1,4291,3:158571302-158605203,3q25.1,yes,,AML,,,L,Dom,,T,NPM1,,,"4291,P58340,ENSG00000178053,MLF1"
MLH1,E.coli MutL homolog gene,4292,3:36993548-37050653,3p21.3,yes,yes,"colorectal, endometrial, ovarian, CNS tumours","colorectal, endometrial, ovarian, CNS","hereditary non-polyposis colorectal cancer, Turcot syndrome","E, O",Rec,,"D, Mis, N, F, S",,,,"MLH1,COCA2,HNPCC,MGC5172,P40692,HNPCC2,FCC2,hMLH1,ENSG00000076242,4292"
MLLT1,"myeloid/lymphoid or mixed-lineage leukemia (trithorax homolog, Drosophila); translocated to, 1 (ENL)",4298,19:6213042-6279784,19p13.3,yes,,AL,,,L,Dom,oncogene,T,KMT2A,,,"MLLT1,ENL,LTG19,YEATS1,Q03111,ENSG00000130382,4298"
MLLT10,"myeloid/lymphoid or mixed-lineage leukemia (trithorax homolog, Drosophila); translocated to, 10 (AF10)",8028,10:21534646-21740235,10p12,yes,,AL,,,L,Dom,,T,"KMT2A, PICALM, CDK6",,,"MLLT10,P55197,AF10,ENSG00000078403,8028"
MLLT11,"myeloid/lymphoid or mixed-lineage leukemia (trithorax homolog, Drosophila); translocated to, 11",10962,1:151039702-151040970,1q21,yes,,ALL,,,L,Dom,,T,KMT2A,,,"MLLT11,Q13015,AF1Q,ENSG00000213190,10962"
MLLT3,"myeloid/lymphoid or mixed-lineage leukemia (trithorax homolog, Drosophila); translocated to, 3 (AF9)",4300,9:20346443-20622256,9p22,yes,,ALL,,,L,Dom,oncogene,T,KMT2A,,,"4300,AF9,AF-9,YEATS3,P42568,ENSG00000171843,MLLT3"
MLLT4,"myeloid/lymphoid or mixed-lineage leukemia (trithorax homolog, Drosophila); translocated to, 4 (AF6)",4301,6:167827134-167952263,6q27,yes,,AL,,,L,Dom,,T,KMT2A,,,"MLLT4,ENSG00000130396,4301"
MLLT6,"myeloid/lymphoid or mixed-lineage leukemia (trithorax homolog, Drosophila); translocated to, 6 (AF17)",4302,17:36861887-36881852,17q21,yes,,AL,,,L,Dom,,T,KMT2A,,,"4302,AF17,P55198,ENSG00000108292,MLLT6"
MN1,meningioma (disrupted in balanced translocation) 1,4330,22:27750915-27800543,22q13,yes,,"AML, meningioma",,,"L, O",Dom,,T,ETV6,,,"Q10571,MN1,4330,ENSG00000169184,dJ353E16_2,MGCR,MGCR1,MGCR1-PEN"
MNX1,motor neuron and pancreas homeobox 1,3110,7:157005520-157010350,7q36,yes,,AML,,,L,Dom,,T,ETV6,yes,Currarino syndrome,"3110,HB9,HLXB9,P50219,ENSG00000130675,HLXB9"
MPL,"myeloproliferative leukaemia virus oncogene, thrombopoietin receptor",4352,1:43337849-43352772,1p34,yes,yes,MPN,MPN,familial essential thrombocythemia,L,Dom,oncogene,Mis,,yes,Congenital amegakaryocytic thrombocytopenia,"P40238,TPOR,RP1-92O14_1,C-MPL,MPLV,CD110,ENSG00000117400,4352,MPL"
MSH2,mutS homolog 2 (E. coli),4436,2:47403192-47482949,2p22-p21,yes,yes,"colorectal, endometrial, ovarian","colorectal, endometrial, ovarian",hereditary non-polyposis colorectal cancer,E,Rec,,"D, Mis, N, F, S",,,,"4436,COCA1,P43246,HNPCC1,FCC1,HNPCC,ENSG00000095002,MSH2"
MSH6,mutS homolog 6 (E. coli),2956,2:47783234-47806860,2p16,yes,yes,colorectal,"colorectal, endometrial, ovarian",hereditary non-polyposis colorectal cancer,E,Rec,,"Mis, N, F, S",,,,"MSH6,GTBP,HNPCC5,HSAP,ENSG00000116062,2956,P52701"
MSI2,musashi homolog 2 (Drosophila),124540,17:57257049-57631832,17q23.2,yes,,CML,,,L,Dom,,T,HOXA9,,,"124540,ENSG00000153944,MSI2"
MSN,moesin,4478,X:65667842-65739893,Xq11.2-q12,yes,,ALCL,,,L,Dom,,T,ALK,,,"MSN,P26038,ENSG00000147065,4478"
MTCP1,mature T-cell proliferation 1,4515,X:155061843-155064023,Xq28,yes,,T cell prolymphocytic leukaemia,,,L,Dom,,T,TRA,,,"MTCP1,C6_1B,GS1-273L24_4,ENSG00000214827,4515"
MTOR,mechanistic target of rapamycin,2475,1:11107485-11259409,1p36,yes,,"endometrial carcinoma, head and neck, clear cell renal cell carcinoma",,,E,Dom,oncogene,"Mis, N",,yes,Smith-Kingsmore syndrome,"FRAP1,FRAP2,MTOR,FLJ44809,FRAP,RAFT1,RAPT1,P42345,ENSG00000198793,2475,FRAP1"
MUC1,"mucin 1, transmembrane",4582,1:155186135-155192843,1q21,yes,,B-NHL,,,L,Dom,,T,IGH,,,"4582,PEM,H23AG,CD227,EMA,MAM6,PUM,ENSG00000185499,MUC1"
MUTYH,mutY homolog (E. coli),4595,1:45329306-45340254,1p34.3-1p32.1,,yes,,colorectal,adenomatous polyposis coli,E,Rec,,Mis,,,,"MUTYH,MYH,MYHbeta,MGC4416,hMYH,ENSG00000132781,4595"
MYB,v-myb myeloblastosis viral oncogene homolog,4602,6:135181514-135217980,6q22-23,yes,,adenoid cystic carcinoma,,,E,Dom,,T,NFIB,,,"4602,c-myb_CDS,c-myb,Cmyb,efg,P10242,ENSG00000118513,MYB"
MYC,v-myc myelocytomatosis viral oncogene homolog (avian),4609,8:127738263-127740958,8q24.12-q24.13,yes,,"Burkitt lymphoma, amplified in other cancers, B-CLL",,,"L, E",Dom,oncogene,"A, T","IGK, BCL5, BCL7A , BTG1, TRA, IGH",,,"MYC,c-Myc,ENSG00000136997,4609"
MYCL,v-myc avian myelocytomatosis viral oncogene lung carcinoma derived homolog,4610,1:39900814-39901434,1p34.2,yes,,small cell lung carcinoma,,,E,Dom,,A,,,,"4610,LMYC,MYCL,ENSG00000116990,MYCL,MYCL1"
MYCN,"v-myc myelocytomatosis viral related oncogene, neuroblastoma derived (avian)",4613,2:15942065-15946097,2p24.1,yes,,neuroblastoma,,,O,Dom,oncogene,A,,,,"4613,N-myc,ODED,MODED,NMYC,ENSG00000134323,MYCN"
MYD88,myeloid differentiation primary response gene (88),4615,3:38138662-38141286,3p22,yes,,ABC-DLBCL,,,L,Dom,oncogene,Mis,,,,"Q99836,MYD88_ENST00000396334,4615,MYD88D"
MYH11,"myosin, heavy polypeptide 11, smooth muscle",4629,16:15708811-15838252,16p13.13-p13.12,yes,,AML,,,L,Dom,,T,CBFB,,,"MYH11,ENSG00000133392,4629"
MYH9,"myosin, heavy polypeptide 9, non-muscle",4627,22:36282668-36349236,22q13.1,yes,,ALCL,,,L,Dom,,T,ALK,yes,"Deafness, autosomal dominant 17, Epstein syndrome, Fechtner syndrome, May-Hegglin anomaly, Sebastian syndrome","MYH9,P35579,DFNA17,ENSG00000100345,4627"
MYO5A,"myosin VA (heavy chain 12, myoxin)",4644,15:52313696-52528806,15q21,yes,,Spitzoid tumour,,,E,Dom,,T,ROS1,yes,Griscelli syndrome,"Q9Y4I1,MYO5A,4644,ENSG00000197535,GS1,MYH12,MYO5,MYR12"
MYOD1,myogenic differentiation 1,4654,11:17719783-17721508,11p15.4,yes,,embryonal rhabdomyosarcoma,,,M,Dom,,Mis,,,,"4654,ENSG00000129152,MYF3,MYOD,PUM,P15172,MYOD1"
NAB2,NGFI-A binding protein 2,4665,12:57089272-57094721,12q13.3,yes,,"solitary fibrous tumour, meningeal haemangiopericytoma",,,"M, O",Dom,oncogene,T,STAT6,,,"4665,MADER,MGC75085,Q15742,ENSG00000166886,NAB2"
NACA,nascent-polypeptide-associated complex alpha polypeptide,4666,12:56712538-56724521,12q23-q24.1,yes,,NHL,,,L,Dom,,T,BCL6,,,"4666,HSD48,NACAP1,FKSG17,Q13765,NACA1,MGC117224,ENSG00000196531,NACA"
NBN,nibrin,4683,8:89935582-89984561,8q21,,yes,,"NHL, glioma, medulloblastoma, rhabdomyosarcoma",Nijmegen breakage syndrome,"L, E, M, O",Rec,,"Mis, N, F",,,,"4683,AT-V2,NBS1,MGC87362,AT-V1,NBS,FLJ10155,ATV,ENSG00000104320,NBN"
NCKIPSD,NCK interacting protein with SH3 domain,51517,3:48674544-48685807,3p21,yes,,ALL,,,L,Dom,,T,KMT2A,,,"NCKIPSD,AF3P21,ORF1,WISH,Q9NZQ3,WASLBP,SPIN90,ENSG00000213672,51517"
NCOA1,nuclear receptor coactivator 1,8648,2:24658678-24768391,2p23,yes,,alveolar rhabdomyosarcoma,,,M,Dom,,T,PAX3,,,"NCOA1,RIP160,F-SRC-1,MGC129720,MGC129719,SRC1,NCoA-1,ENSG00000084676,8648"
NCOA2,nuclear receptor coactivator 2 (TIF2),10499,8:70113632-70216745,8q13.1,yes,,"AML, chondrosarcoma, rhabdomyosarcoma",,,"L, M",Dom,,T,"KAT6A, HEY1, NCOA2",,,"NCOA2,TIF2,MGC138808,NCoA-2,ENSG00000140396,10499"
NCOA4,nuclear receptor coactivator 4 - PTC3 (ELE1),8031,10:51579142-51586417,10q11.2,yes,,papillary thyroid,,,E,Dom,,T,RET,,,"NCOA4,RP11-481A12_4,ARA70,DKFZp762E1112,RFG,Q13772,ELE1,PTC3,ENSG00000138293,8031"
NCOR1,nuclear receptor corepressor 1,9611,17:16032296-16194569,17p11.2,yes,,breast,,,E,Rec,,"Mis, F, N, O",,yes,Ulnar-mammary syndrome,"NCOR1,hCIT529I10,KIAA1047,hN-CoR,O75376,TRAC1,MGC104216,N-CoR,ENSG00000141027,9611"
NCOR2,nuclear receptor corepressor 2,9612,12:124325402-124495251,12q24,yes,,prostate,,,E,Dom,TSG,"Mis, F, N, O",,,,"NCOR2,SMRTE-tau,TRAC1,CTG26,SMRT,TRAC-1,TNRC14,SMRTE,ENSG00000196498,9612"
NDRG1,N-myc downstream regulated 1,10397,8:133238878-133284311,8q24.3,yes,,prostate,,,E,Dom,,T,ERG,,,"10397,NDR1,CAP43,NMSL,PROXY1,TDD5,RTP,GC4,HMSNL,TARG1,CMT4D,RIT42,Q92597,ENSG00000104419,NDRG1"
NF1,neurofibromatosis type 1 gene,4763,17:31095310-31374155,17q12,yes,yes,"neurofibroma, glioma","neurofibroma, glioma",neurofibromatosis type 1,O,Rec,,"D, Mis, N, F, S, O",,,,"NF1,NFNS,P21359,ENSG00000196712,4763"
NF2,neurofibromatosis type 2 gene,4771,22:29603999-29694802,22q12.2,yes,yes,"meningioma, acoustic neuroma, renal","meningioma, acoustic neuroma",neurofibromatosis type 2,O,Rec,,"D, Mis, N, F, S, O",,,,"4771,ACN,BANF,Merlin,SCH,P35240,ENSG00000186575,NF2"
NFATC2,"nuclear factor of activated T-cells, cytoplasmic, calcineurin-dependent 2",4773,20:51391396-51542499,20q13.2,yes,,Ewing sarcoma,,,M,Dom,,T,EWSR1,,,"4773,ENSG00000101096,KIAA0611,NFAT1,NFATP,Q13469,NFATC2"
NFE2L2,nuclear factor (erythroid-derived 2)-like 2 (NRF2),4780,2:177230785-177264576,2q31,yes,,"NSCLC, HNSCC",,,E,Dom,,Mis,,,,"4780,ENSG00000116044,NRF2,Q16236,NFE2L2"
NFIB,nuclear factor I/B,4781,9:14088309-14313511,9p24.1,yes,,"adenoid cystic carcinoma, lipoma",,,E,Dom,,T,"MYB, HGMA2",,,"4781,RP11-280O24_2,NFIB3,NFI-RED,NFIB2,ENSG00000147862,NFIB"
NFKB2,nuclear factor of kappa light polypeptide gene enhancer in B-cells 2 (p49/p100),4791,10:102395960-102402376,10q24,yes,,B-NHL,,,L,Dom,oncogene,T,IGH,,,"LYT10,ENSG00000077150,NFKB2,4791,LYT-10"
NFKBIE,"nuclear factor of kappa light polypeptide gene enhancer in B-cells inhibitor, epsilon",4794,6:44259219-44265763,6p21.1,yes,,"CLL, desmoplastic melanoma",,,"L, E",Dom/Rec,,"F, Mis",,,,"4794,ENSG00000146232,IKBE,O00221,NFKBIE"
NIN,ninein (GSK3B interacting protein),51199,14:50725872-50822056,14q24,yes,,MPN,,,L,Dom,,T,PDGFRB,,,"NIN,KIAA1565,ENSG00000100503,51199"
NKX2-1,NK2 homeobox 1,7080,14:36517278-36519357,14q13,yes,,NSCLC,,,E,Dom,,A,,,,"7080,BCH,NK-2,NKX2_1,TTF-1,NKX2A,BHC,TEBP,TITF1,P43699,ENSG00000136352,TITF1"
NONO,"non-POU domain containing, octamer-binding",4841,X:71290638-71300076,Xq13.1,yes,,papillary renal,,,E,Dom,,T,TFE3,,,"4841,Q15233,P54,NMT55,P54NRB,NRB54,ENSG00000147140,NONO"
NOTCH1,"Notch homolog 1, translocation-associated (Drosophila) (TAN1)",4851,9:136496071-136545786,9q34.3,yes,,"T-ALL, breast, bladder, skin SCC, lung SCC, head and neck SCC",,,"L, E",Dom/Rec,oncogene/TSG,"T, Mis, O","TRB, SEC16A, GABBR2",,,"NOTCH1,TAN1,hN1,ENSG00000148400,4851,P46531"
NOTCH2,Notch homolog 2,4853,1:119915306-120069406,1p13-p11,yes,,"marginal zone lymphoma, DLBCL, bladder",,,"L, E",Dom/Rec,oncogene/TSG,"N, F, Mis",,yes,"Hajdu-Cheney syndrome, serpentine fibula-polycystic kidney syndrome","4853,Q04721,hN2,AGS2,ENSG00000134250,NOTCH2"
NPM1,"nucleophosmin (nucleolar phosphoprotein B23, numatrin)",4869,5:171387949-171410565,5q35,yes,,"NHL, APL, AML",,,L,Dom,,"T, F","ALK, RARA, MLF1",,,"4869,NPM,MGC104254,B23,P06748,ENSG00000181163,NPM1"
NR4A3,"nuclear receptor subfamily 4, group A, member 3 (NOR1)",8013,9:99828041-99863867,9q22,yes,,extraskeletal myxoid chondrosarcoma,,,M,Dom,,T,"EWSR1, TAF15, TCF12, TFG",,,"NR4A3,MINOR,CSMF,NOR1,CHN,Q92570,ENSG00000119508,8013"
NRAS,neuroblastoma RAS viral (v-ras) oncogene homolog,4893,1:114708535-114716160,1p13.2,yes,,"melanoma, MM, AML, thyroid",,,"L, E",Dom,oncogene,Mis,,,,"4893,N-ras,NRAS1,P01111,ENSG00000213281,NRAS"
